{"artifact_type":"BrowserPageCapture","spec_version":"v0.1","requested_url":"https://example.com/article?ref=nav","current_url":"https://example.com/article","canonical_url":"https://example.com/article","document_title":"Contract Golden Example","document_language":"en","meta_description":null,"json_ld":[{"@context":"https://schema.org","@type":"Article","headline":"Contract Golden Example"}],"selected_text":null,"main_text":"Main article body content for the golden fixture.","rendered_text":"Rendered body text including navigation and footer.","captured_at":"2026-08-08T12:00:00.000Z"}